Date,Publication,Headline,URL,Categories,Topics,Major Ad Tech Companies,Retail Media Networks,Attribution Topics,Ad Formats,Agencies,Relevance Score,Summary
2026-04-20,Adweek,Marketers Need to Stop Chasing Data and Start Harnessing Audience Signals,https://www.adweek.com/social-marketing/marketers-need-to-stop-chasing-data-and-start-harnessing-audience-signals/,Industry/Business,"audience signals, social listening, data strategy",,,,Social,,3,A sponsored post by Sprout Social arguing that marketers should focus on extracting meaningful audience signals from their existing data rather than accumulating more of it.
2026-04-20,Adweek,Consumers Are Taking a New Purchase Journey on Social,https://www.adweek.com/social-marketing/consumers-are-taking-a-new-purchase-journey-on-social/,"Ad Formats, Industry/Business","social commerce, consumer purchase journey, social media search, social listening",,,,Social,,5,A sponsored post with Brandwatch exploring how consumer purchase journeys are shifting from traditional search engines to social media platforms.
2026-04-20,Adweek,"If Comments Are the New Frontline, How Is Your Brand Showing Up?",https://www.adweek.com/social-marketing/if-comments-are-the-new-frontline-how-is-your-brand-showing-up/,"Ad Formats, Technology, Industry/Business","social media comments moderation, AI in social media, brand safety, community management",,,,Social,,4,A sponsored post with Respondology discussing how AI is reshaping the way brands manage and engage with social media comments as a critical brand touchpoint.
2026-04-20,Adweek,Social Media Marketing Enters Its AI Intelligence Era,https://www.adweek.com/social-marketing/social-media-marketing-enters-its-ai-intelligence-era/,"Ad Formats, Technology","AI in social media marketing, data signals, social media analytics",,,,Social,,5,A sponsored post with Viral Nation discussing how AI is transforming social media marketing by leveraging the massive volume of data signals generated across platforms.
2026-04-20,Adweek,What Social Media Success Looks Like in a Post-Follower World,https://www.adweek.com/social-marketing/what-social-media-success-looks-like-in-a-post-follower-world/,"Ad Formats, Industry/Business","social media algorithms, engagement metrics, content strategy, follower metrics",,,,Social,,3,A sponsored post from Dash Social discussing how social media success metrics are shifting away from follower counts toward personalized content and engagement as algorithms evolve.
2026-04-20,Adweek,EXCLUSIVE: Leaked Deck Reveals StackAdapt’s Playbook for ChatGPT Ads,https://www.adweek.com/media/exclusive-leaked-deck-reveals-stackadapts-playbook-for-chatgpt-ads/,"Programmatic, Ad Formats, Technology","DSPs, ChatGPT advertising, generative AI ad placements, prompt-based targeting, CPM pricing, pilot programs",,,,Native,,8,"A leaked StackAdapt deck reveals the DSP's pilot plan to sell ChatGPT ad placements based on prompt relevance, with CPMs of $15–$60 and a $50,000 minimum spend."
2026-04-20,Adweek,6 Coachella Brand Activations That Were Actually Worth Waiting in Line For,https://www.adweek.com/creativity/6-coachella-brand-activations-that-were-actually-worth-waiting-in-line-for/,Industry/Business,"experiential marketing, brand activations, event marketing",,,,,,2,A roundup of standout brand activations at Coachella 2026 that went beyond traditional marketing moments.
2026-04-20,Adweek,Jellyfish Wants You to Use Large Language Models to Plan Your Ad Buys,https://www.adweek.com/media/jellyfish-wants-you-to-use-large-language-models-to-plan-your-ad-buys/,"FAANG, Technology, Ad Formats","large language models, AI-driven media planning, Performance Max, search themes, paid media planning",Google,,,Search,,7,Jellyfish partnered with the Project Management Institute to use large language models to expand Performance Max search themes and improve paid media planning outcomes.
2026-04-20,Adweek,Entries Are Now Open for ADWEEK Team Visionary Awards 2026,https://www.adweek.com/brand-marketing/entries-are-now-open-for-adweek-team-visionary-awards-2026/,Industry/Business,"awards, industry recognition",,,,,,1,ADWEEK announces that submissions are open for its 2026 Team Visionary Awards recognizing standout campaigns and team achievements.
2026-04-20,Adweek,ADWEEK Sports Marketing MVPs 2026 Entries Now Open,https://www.adweek.com/brand-marketing/adweek-sports-marketing-mvps-2026-entries-now-open/,Industry/Business,"sports marketing, industry awards",,,,,,1,Adweek has opened entries for its 2026 Sports Marketing MVPs awards recognizing leaders in the sports marketing industry.
2026-04-20,Digiday,Digiday+ Research: Agencies punt budget growth expectations to 2027 — while AI worries intensify,https://digiday.com/media-buying/digiday-research-agencies-punt-budget-growth-expectations-to-2027-while-ai-worries-intensify/?utm_campaign=digidaydis&utm_medium=rss&utm_source=general-rss,"Industry/Business, Technology","agency budgets, AI impact on agencies, client spending",,,,,,5,A Digiday+ Research survey finds agencies are delaying budget growth expectations to 2027 amid concerns over client spending and the growing impact of AI.
2026-04-20,Digiday,Why Mondelez is hiring a global lead to solve for AI-driven shopping bots,https://digiday.com/marketing/why-mondelez-is-hiring-a-global-lead-to-solve-for-ai-driven-shopping-bots/?utm_campaign=digidaydis&utm_medium=rss&utm_source=general-rss,"Industry/Business, Technology, Retail Media","agentic commerce, AI shopping bots, CPG marketing, ecommerce strategy",,,,,,6,Mondelez is hiring a global lead to navigate the rise of AI-driven agentic commerce and shopping bots reshaping how consumers discover and purchase products.
2026-04-20,Digiday,From page views to propensity: How the Daily Mail is retooling for a zero-click world,https://digiday.com/media/from-page-views-to-propensity-how-the-daily-mail-is-retooling-for-a-zero-click-world/?utm_campaign=digidaydis&utm_medium=rss&utm_source=general-rss,"Industry/Business, Technology","zero-click search, publisher strategy, dynamic paywall, AI personalization, content verticals, app engagement, audience retention",,,,,,4,"The Daily Mail is overhauling its product strategy — including games, niche content hubs, an AI-driven paywall, and an app-first approach — to combat the traffic decline caused by zero-click search results."
2026-04-20,Digiday,"As upfront negotiations near, buyers chart path through complex sports market",https://digiday.com/media-buying/as-upfront-negotiations-near-buyers-chart-path-through-complex-sports-market/?utm_campaign=digidaydis&utm_medium=rss&utm_source=general-rss,"Industry/Business, Ad Formats, Privacy/Regulation","upfront negotiations, sports rights, NFL, DOJ probe, TV ad buying",,,,"CTV/OTT, Video",,6,"As the upfronts approach, buyers navigate an increasingly fragmented and complex sports rights landscape, underscored by the DOJ's probe into the NFL."
2026-04-20,Digiday,The World Cup is set to lift demand for digital out-of-home spending,https://digiday.com/media-buying/the-world-cup-is-set-to-lift-demand-for-digital-out-of-home-spending/?utm_campaign=digidaydis&utm_medium=rss&utm_source=general-rss,"Ad Formats, Industry/Business","DOOH advertising, World Cup advertising, sports advertising, ad spend trends",,,,DOOH,,6,Digital out-of-home providers are vying for increased advertiser spending tied to the FIFA World Cup.
2026-04-20,Digiday,"Media Buying Briefing: As Q1 results from a few holdcos show, the market’s not panicking, yet",https://digiday.com/media-buying/media-buying-briefing-as-q1-results-from-a-few-holdcos-show-the-markets-not-panicking-yet/?utm_campaign=digidaydis&utm_medium=rss&utm_source=general-rss,Industry/Business,"holding companies Q1 earnings, media spend trends, agency financial performance",,,,,,5,"An analysis of Q1 results from advertising holding companies suggesting the media buying market remains stable despite economic uncertainty, with marketers wary of cutting spend."
2026-04-17,Digiday,Bauer Media Group slashes publishing headcount in company-wide restructure,https://digiday.com/media/bauer-media-group-slashes-publishing-headcount-in-company-wide-restructure/?utm_campaign=digidaydis&utm_medium=rss&utm_source=general-rss,Industry/Business,"publisher layoffs, AI Overviews impact on publishers, media restructuring",,,,,,4,"Bauer Media Group is cutting 20-30% of its publishing headcount in a company-wide restructure, with AI Overviews and rising costs tied to the Iran conflict cited as contributing factors."
2026-04-17,Digiday,Puma’s AI head says the brand is still giving ‘the keys to the consumer’ as it invests in digital concierge,https://digiday.com/marketing/pumas-ai-head-says-the-brand-is-still-giving-the-keys-to-the-consumer-as-it-invests-in-digital-concierge/?utm_campaign=digidaydis&utm_medium=rss&utm_source=general-rss,"Technology, Industry/Business","AI in marketing, digital concierge, in-store brand experience, generative AI",,,,,,3,"Puma has launched an AI-powered 'digital human' concierge named Dylan at its Las Vegas flagship store, reflecting the brand's approach to consumer-led AI experiences."
2026-04-17,Digiday,The Rundown: Q1 dealmaking cools across ad tech and martech as AI remains the hottest ticket,https://digiday.com/marketing/the-rundown-q1-dealmaking-cools-across-ad-tech-and-martech-as-ai-remains-the-hottest-ticket/?utm_campaign=digidaydis&utm_medium=rss&utm_source=general-rss,Industry/Business,"M&A activity, ad tech dealmaking, martech dealmaking, AI investment, LUMA Partners Q1 report, macroeconomic uncertainty",,,,,,7,"LUMA Partners' Q1 report shows ad tech and martech M&A activity slowed due to macroeconomic uncertainty, though AI-related deals continue to drive investor interest."
2026-04-17,Digiday,‘Everything is coming down’: ChatGPT ads are getting cheaper,https://digiday.com/marketing/everything-is-coming-down-chatgpt-ads-are-getting-cheaper/?utm_campaign=digidaydis&utm_medium=rss&utm_source=general-rss,"Industry/Business, Ad Formats, Technology","ChatGPT ads, CPM pricing, generative AI advertising, ad pilot programs",,,,Native,,8,"ChatGPT's advertising pilot is seeing CPMs drop from $60 to as low as $25 just nine weeks into testing, signaling softening pricing in OpenAI's early ad offering."
2026-04-17,Digiday,Future of Marketing Briefing: Why brand builders are back in fashion,https://digiday.com/marketing/future-of-marketing-briefing-why-brand-builders-are-back-in-fashion/?utm_campaign=digidaydis&utm_medium=rss&utm_source=general-rss,Industry/Business,"brand building, CPG marketing, marketing talent, performance vs brand marketing",,,,,,4,CPG companies are shifting away from performance-focused media optimizers and rehiring traditional brand-building marketers.
2026-04-16,Digiday,U.K. brands increase media spend despite economic storm clouds,https://digiday.com/media-buying/uk-brands-increase-media-spend-despite-economic-stormclouds/?utm_campaign=digidaydis&utm_medium=rss&utm_source=general-rss,Industry/Business,"UK ad spend, IPA Bellwether report, CMO sentiment, macroeconomic conditions",,,,,,4,The IPA's quarterly Bellwether report shows U.K. brands are increasing media budgets despite economic and geopolitical headwinds.
2026-04-16,Digiday,Amazon hits pause on controversial change to its advertising payment system that had caused a seller revolt,https://digiday.com/marketing/amazon-hits-pause-on-controversial-change-to-its-advertising-payment-system-that-had-caused-a-seller-revolt/?utm_campaign=digidaydis&utm_medium=rss&utm_source=general-rss,"Retail Media, FAANG, Industry/Business","Amazon advertising payment policy, seller pushback, Sponsored Products",Amazon,Amazon Ads,,Retail Media Ads,,7,Amazon has paused a controversial change to its advertising payment system after coordinated backlash from its seller community.
2026-04-16,Digiday,OpenAI builds tool to track whether ChatGPT ads convert,https://digiday.com/marketing/openai-builds-tool-to-track-whether-chatgpt-ads-convert/?utm_campaign=digidaydis&utm_medium=rss&utm_source=general-rss,"Attribution/Measurement, Technology, Industry/Business","conversion tracking, ad pixels, AI platform advertising, ChatGPT ads",,,"Last-Click, View-Through",,,8,"OpenAI is piloting a conversion-tracking pixel with select advertisers to measure whether ads shown in ChatGPT drive outcomes, signaling its early moves into ad measurement infrastructure."
2026-04-16,Digiday,Media Briefing: The ‘SaaS-pocalypse’ is spreading to publishers,https://digiday.com/media/media-briefing-the-saas-pocalypse-is-spreading-to-publishers/?utm_campaign=digidaydis&utm_medium=rss&utm_source=general-rss,"Industry/Business, Technology","AI tools, publisher technology, build vs buy, SaaS, vibe-coding",,,,,,4,"Publishers are increasingly using AI-powered vibe-coding tools to build their own software in-house, disrupting traditional SaaS vendor relationships."
2026-04-20,AdExchanger,Brand-Trained Agents Can Give Marketers A Fuller View Of Their Customers,https://www.adexchanger.com/ai/brand-trained-agents-can-give-marketers-a-fuller-view-of-their-customers/,"Technology, Industry/Business","agentic commerce, AI agents, brand-trained agents, customer insights, on-site AI",,,,,,5,"Agentic commerce startup Envive builds brand-trained on-site AI agents for companies like Clove, giving marketers clearer insights into customer intent and shopping behavior."
2026-04-20,AdExchanger,Why A 1967 Privacy Law Is Powering A New Wave Of Ad Tech Lawsuits,https://www.adexchanger.com/data-privacy-roundup/why-a-1967-privacy-law-is-powering-a-new-wave-of-ad-tech-lawsuits/,"Privacy/Regulation, Industry/Business","CIPA, California Invasion of Privacy Act, ad tech litigation, wiretapping lawsuits, data privacy law",,,,,,7,A 1967 California wiretapping law (CIPA) is being leveraged in a growing wave of privacy lawsuits targeting ad tech companies.
2026-04-20,AdExchanger,What Happens When The Attribution Cartel Meets Advertising’s Halo Effect?,https://www.adexchanger.com/data-driven-thinking/what-happens-when-the-attribution-cartel-meets-advertisings-halo-effect/,"FAANG, Attribution/Measurement, Privacy/Regulation, Programmatic","Privacy Sandbox, browser-level ad controls, attribution, halo effect",Google,,,,,7,"The article examines how browser vendors are collectively taking over ad features in the wake of Google's Privacy Sandbox winding down, and what that shift means for attribution and advertising's halo effect."
2026-04-20,AdExchanger,Prompt For More Ads; Who Advertises The Advertisers?,https://www.adexchanger.com/daily-news-roundup/prompt-for-more-ads-who-advertises-the-advertisers/,"Industry/Business, Privacy/Regulation, Technology","AI advertising, OpenAI ads, consumer data privacy, Big Tech data practices",,,,,,6,"AdExchanger's daily roundup covers OpenAI's move into advertising and the economic tensions it raises, alongside grassroots efforts teaching consumers to protect their data from Big Tech."
2026-04-17,AdExchanger,Reaching For More Reach,https://www.adexchanger.com/the-big-story/reaching-for-more-reach/,"Retail Media, Industry/Business","diverse-owned media, RFPs, audience data, reach extension, retail media maturity",,,,Retail Media Ads,,6,"Diverse-owned media companies are leveraging their data to extend reach amid shifting RFPs, while retail media is characterized as still being in an early, immature 'potty-training' phase."
2026-04-17,AdExchanger,Hot Take: YouTube Shouldn’t Rely On Creators To Convince Brands It’s TV,https://www.adexchanger.com/ctv-roundup/hot-take-youtube-shouldnt-rely-on-creators-to-convince-brands-its-tv/,"FAANG, Ad Formats, Industry/Business","YouTube advertising, TV upfronts, creator economy, CTV positioning",Google,,,"CTV/OTT, Video",,7,"The article critiques YouTube's strategy of leaning on its creators to pitch advertisers during the upfronts as proof that it qualifies as TV, arguing this undermines its authenticity positioning."
2026-04-17,AdExchanger,"Comic: ‘But, But… You Need A Licensing Deal!’",https://www.adexchanger.com/comic-strip/comic-but-but-you-need-a-licensing-deal/,Industry/Business,licensing deals,,,,,,2,A weekly AdExchanger comic strip humorously referencing licensing deals in the digital advertising ecosystem.
2026-04-17,AdExchanger,The OpenAI Pixel Has Landed; Amazon’s Credit Card Ban Triggers An Ad Boycott,https://www.adexchanger.com/daily-news-roundup/the-openai-pixel-has-landed-amazons-credit-card-ban-triggers-an-ad-boycott/,"FAANG, Retail Media, Attribution/Measurement, Technology, Industry/Business","OpenAI tracking pixel, conversion tracking, Amazon seller boycott, Conversions API (CAPI), server-side tracking",Amazon,Amazon Ads,,,,7,"A roundup covering OpenAI's launch of a tracking pixel, an Amazon seller ad boycott sparked by a credit card ban, and DirecTV adopting Conversions API (CAPI) for server-side tracking."
2026-04-16,AdExchanger,Don’t Worry About Netflix – It’s Doing Fine Without Warner Bros. Discovery,https://www.adexchanger.com/tv/dont-worry-about-netflix-its-doing-fine-without-warner-bros-discovery/,"FAANG, Industry/Business, Ad Formats","streaming M&A, ad-supported streaming, Netflix ads business",Netflix,,,CTV/OTT,,6,Netflix lost the bidding war for Warner Bros. Discovery to Paramount but remains well-positioned in the streaming and ad-supported TV market.
2026-04-16,AdExchanger,Paramount’s Upfront Pitch Is About Three Things,https://www.adexchanger.com/tv/paramounts-upfront-pitch-is-about-three-things/,"Ad Formats, Industry/Business, Technology","CTV advertising, dynamic ad insertion, live sports streaming, ad tech stack consolidation, performance advertising products, upfronts",,,,"CTV/OTT, Video",,7,"Paramount's upfront pitch focuses on unifying the Paramount+ and Pluto TV ad tech stacks, launching a performance ad product, and rolling out dynamic ad insertion for live sports."
2026-04-27,Adweek,Omnicom’s New Influencer Tool Uses Agentic AI to Tweak Content For Brand Safety,https://www.adweek.com/commerce/omnicoms-new-influencer-tool-uses-agentic-ai-to-tweak-content-for-brand-safety/,"FAANG, Technology, Industry/Business","agentic AI, influencer marketing, brand safety, generative AI content, creator content moderation",Google,,,Social,,6,Omnicom has launched a new influencer marketing tool that uses agentic AI powered by Google's Gemini Veo and Nano Banana models to automatically modify creator content for brand safety compliance.
2026-04-27,Adweek,Goodway Group and Optable Partner to Feed AI Agents Cleaner Data,https://www.adweek.com/media/exclusive-goodway-group-and-optable-partner-to-feed-ai-agents-on-cleaner-data/,"Technology, Industry/Business, Attribution/Measurement","AI agents in ad tech, data clean rooms, agency data infrastructure, agentic AI",,,Clean Rooms,,,7,Goodway Group has partnered with Optable to improve data infrastructure and clean room capabilities to support the growing use of AI agents in ad tech.
2026-04-27,Adweek,Walmart Targets Small Businesses With Streaming Ad Marketplace,https://www.adweek.com/commerce/walmart-targets-small-businesses-with-streaming-ad-marketplace/,"Retail Media, Programmatic, Ad Formats","CTV advertising, Walmart DSP, self-serve ad platforms, small business advertising, retail media marketplace",,Walmart Connect,,"CTV/OTT, Search, Display",,8,"Walmart launched Connect Select, a new marketplace giving small businesses access to CTV inventory alongside search and display through Walmart DSP."
2026-04-27,Adweek,How Hendrick’s Blended AI and Theater For Its Biggest Launch in a Decade,https://www.adweek.com/creativity/how-hendricks-blended-ai-and-theater-for-its-biggest-launch-in-a-decade/,"Industry/Business, Technology","AI in creative, brand campaign, experiential marketing",,,,,,2,"Hendrick's Gin partnered with agency Ace of Hearts and AI artist David Szauder to create a theatrical, AI-infused brand campaign for its biggest product launch in a decade."
2026-04-27,Adweek,Hershey Bets on AI Agents to Fix Its $2 Billion Marketing Blind Spot,https://www.adweek.com/brand-marketing/exclusive-hershey-bets-on-ai-agents-to-fix-its-2-billion-marketing-blind-spot/,"Attribution/Measurement, Industry/Business, Technology","Marketing Mix Modeling, agentic AI, media budget allocation, AI in marketing analytics",,,MMM,,,7,"Hershey is partnering with Mutinex and Tracer to apply agentic AI to its marketing mix modeling, aiming to speed up analysis and improve media budget allocation decisions."
2026-04-24,Adweek,Week of April 13 Evening News Ratings: NBC and CBS Grow in Demo,https://www.adweek.com/tvnewser/week-of-april-13-2026-evening-news-ratings/,Industry/Business,"evening news ratings, broadcast TV viewership",,,,,,2,NBC and CBS evening news broadcasts posted growth in the Adults 25-54 demographic for the week of April 13.
2026-04-24,Adweek,Ticker: Cable Networks Offer Live Coverage of the WHCD,https://www.adweek.com/tvnewser/ticker-cable-networks-offer-live-coverage-of-the-whcd/,Industry/Business,"cable news coverage, White House Correspondents Dinner",,,,,,1,A brief news ticker about cable networks providing live coverage of the White House Correspondents Dinner and a Jenna Bush Hager interview with former presidents.
2026-04-24,Adweek,Week of April 13 Morning News Ratings: CBS Has Only Morning Show to Grow,https://www.adweek.com/tvnewser/week-of-april-13-2026-morning-news-ratings/,Industry/Business,"morning TV ratings, broadcast news",,,,,,1,"A ratings report on network morning news shows for the week of April 13, noting CBS was the only morning show to grow while NBC's Today stayed at No. 1."
2026-04-24,Adweek,HP Quietly Launched a Streaming App to Grow Its Advertising Ambitions,https://www.adweek.com/commerce/hp-tv-streaming-app-advertising-ambitions/,"Ad Formats, Industry/Business, Technology","streaming app launch, ad-supported streaming, laptop viewing, device manufacturer advertising",,,,"CTV/OTT, Video",,6,"HP has quietly launched HP TV+, a streaming app aimed at laptop-based viewers, as part of its expanding advertising business ambitions."
2026-04-24,Adweek,&#8216;It Existed Before Fox News Channel&#8217;: Inside the 30th Anniversary of Fox News Sunday,https://www.adweek.com/convergent-tv/it-existed-before-fox-news-channel-inside-the-30th-anniversary-of-fox-news-sunday/,,,,,,,,1,Fox News Sunday celebrates its 30th anniversary with reflections from anchor Shannon Bream and executive producer Jessica Loker.
2026-04-27,Digiday,Meta eyes CTV expansion to fuel its next wave of ad growth,https://digiday.com/future-of-tv/meta-eyes-ctv-expansion-to-fuel-its-next-wave-of-ad-growth/?utm_campaign=digidaydis&utm_medium=rss&utm_source=general-rss,"FAANG, Ad Formats, Industry/Business","CTV advertising, performance advertising, Meta ad growth",Meta,,,CTV/OTT,,8,Meta is planning to expand its performance advertising business into Connected TV as a new avenue for ad revenue growth.
2026-04-27,Digiday,News UK turns The Times’ first-party data into synthetic audiences for advertisers,https://digiday.com/media/news-uk-turns-the-times-first-party-data-into-synthetic-audiences-for-advertisers/?utm_campaign=digidaydis&utm_medium=rss&utm_source=general-rss,"Programmatic, Privacy/Regulation, Technology","first-party data, synthetic audiences, audience planning, publisher data strategy, cookieless targeting",,,Cookieless,Display,,7,"News UK is leveraging The Times' first-party data to create a synthetic audience planning tool for advertisers, reflecting publishers' push to monetize proprietary data in a cookieless landscape."
2026-04-27,Digiday,"Marketers join OpenAI’s ad pilot, nudged by FOMO",https://digiday.com/marketing/marketers-join-openais-ad-pilot-nudged-by-fomo/?utm_campaign=digidaydis&utm_medium=rss&utm_source=general-rss,"Industry/Business, Technology","OpenAI ad platform, AI advertising, marketer pilot programs, emerging ad platforms",,,,,,7,"Marketers are signing up for OpenAI's newly launched ad pilot largely out of fear of missing out, though it remains unclear whether the platform delivers genuine value."
2026-04-27,Digiday,Media Buying Briefing: Agencies turn creators into test labs for campaigns and product innovation,https://digiday.com/media-buying/media-buying-briefing-agencies-turn-creators-into-test-labs-for-campaigns-and-product-innovation/?utm_campaign=digidaydis&utm_medium=rss&utm_source=general-rss,Industry/Business,"creator marketing, influencer marketing, agency strategy, campaign testing, product innovation",,,,Social,,5,Agencies like Horizon Media's Blue Hour Studios are using creators early in the campaign process to test and refine advertising and product innovation for brands like SharkNinja.
2026-04-24,Digiday,Why Coca-Cola has made World Cup TV ads one part of its sports marketing play,https://digiday.com/marketing/why-coca-cola-has-made-world-cup-tv-ads-one-part-of-its-sports-marketing-play/?utm_campaign=digidaydis&utm_medium=rss&utm_source=general-rss,"Ad Formats, Industry/Business","sports marketing, World Cup advertising, brand campaigns, multi-channel advertising",,,,"Social, Video",,4,"Coca-Cola's Powerade brand is using a 360-degree marketing approach across social, digital, and traditional TV for its World Cup 2026 campaign."
2026-04-24,Digiday,"Future of Marketing Briefing: In the age of AI, taste is the new competitive advantage",https://digiday.com/marketing/future-of-marketing-briefing-in-the-age-of-ai-taste-is-the-new-competitive-advantage/?utm_campaign=digidaydis&utm_medium=rss&utm_source=general-rss,"Industry/Business, Technology","generative AI in marketing, creative differentiation, brand strategy",,,,,,4,"An opinion piece arguing that as AI tools commoditize marketing output, human taste and creative judgment have become marketers' most durable competitive advantage."
