2026-04-24,Digiday,Nike’s Boston Marathon billboard chiding walkers inspires new Asics and Ecco campaigns,https://digiday.com/marketing/nikes-boston-marathon-billboard-chiding-walkers-inspires-new-asics-and-ecco-campaigns/?utm_campaign=digidaydis&utm_medium=rss&utm_source=general-rss,"Industry/Business, Ad Formats","brand marketing, out-of-home advertising, competitive brand response, Boston Marathon sponsorship",,,,DOOH,,4,"Asics and Ecco launched inclusivity-themed campaigns in response to Nike's controversial Boston Marathon billboard that mocked walkers, which Nike subsequently removed."
2026-04-24,Digiday,Sports guidance to brands from three sources: Keep the fan top of mind and you might just win,https://digiday.com/marketing/sports-guidance-to-brands-from-three-sources-keep-the-fan-top-of-mind-and-you-might-just-win/?utm_campaign=digidaydis&utm_medium=rss&utm_source=general-rss,Industry/Business,"sports marketing, agency talent acquisition, AI in advertising",,,,,,3,"Agencies are building out sports marketing practices by hiring from leagues and cautiously deploying AI, with a focus on keeping fans central to brand strategy."
2026-04-23,Digiday,Beehiiv adds even more features to go up against competitors and win over creators,https://digiday.com/media/beehiiv-adds-even-more-features-to-go-up-against-competitors-and-win-over-creators/?utm_campaign=digidaydis&utm_medium=rss&utm_source=general-rss,"Industry/Business, Ad Formats","creator economy, newsletter platforms, podcast platforms, Beehiiv",,,,Audio,,4,"Beehiiv is expanding its platform with new features, including podcasts, to compete with rival creator platforms and attract more creators."
2026-04-23,Digiday,YouTube is turning audio into an ad product — SiriusXM is selling it,https://digiday.com/marketing/youtube-is-turning-audio-into-an-ad-product-siriusxm-is-selling-it/?utm_campaign=digidaydis&utm_medium=rss&utm_source=general-rss,"FAANG, Ad Formats, Industry/Business","YouTube audio ads, SiriusXM Media partnership, audio advertising sales, ad inventory monetization",Google,,,Audio,,8,"YouTube has entered an exclusive U.S. partnership with SiriusXM Media to sell its audio-first ad inventory, formalizing YouTube's push into the audio advertising market."
2026-04-23,Digiday,Retailers offer fuel perks as consumers look for relief from $4 gas amid U.S.-Iran war,https://digiday.com/marketing/retailers-offer-fuel-perks-as-consumers-look-for-relief-from-4-gas-amid-u-s-iran-war/?utm_campaign=digidaydis&utm_medium=rss&utm_source=general-rss,Industry/Business,"fuel rewards programs, loyalty programs, consumer promotions, foot traffic",,,,,,2,Retailers are launching limited-time fuel discount perks to drive foot traffic and attract cost-conscious shoppers as gas prices rise amid the U.S.-Iran conflict.
2026-04-23,Digiday,NHL looks to TikTok to capitalize on Heated Rivalry and Olympics as it grows beyond U.S. and Canada,https://digiday.com/marketing/nhl-looks-to-tiktok-to-capitalize-on-heated-rivalry-and-olympics-as-it-grows-beyond-u-s/?utm_campaign=digidaydis&utm_medium=rss&utm_source=general-rss,"Ad Formats, Industry/Business","TikTok marketing, social media strategy, sports media rights, international audience expansion",,,,Social,,4,The NHL is using TikTok to grow international fan engagement and boost the value of its media rights ahead of the Olympics and the Heated Rivalry series.
2026-04-23,Digiday,"Media Briefing: As traffic declines, publishers see gains in commerce conversions and CTR",https://digiday.com/media/media-briefing-as-traffic-declines-publishers-see-gains-in-commerce-conversions-and-ctr/?utm_campaign=digidaydis&utm_medium=rss&utm_source=general-rss,Industry/Business,"publisher commerce revenue, affiliate commerce, traffic decline, click-through rates, audience conversion",,,,,,4,Publishers like Forbes and Apartment Therapy are offsetting declining traffic with stronger commerce conversion rates and click-through performance.
2026-04-23,Digiday,Why brands like The League are making the first move to take advantage of LinkedIn’s creator appeal,https://digiday.com/marketing/why-brands-like-the-league-are-making-the-first-move-to-take-advantage-of-linkedins-creator-appeal/?utm_campaign=digidaydis&utm_medium=rss&utm_source=general-rss,"Ad Formats, Industry/Business","LinkedIn creator marketing, influencer marketing, B2C on B2B platforms, creator economy",,,,Social,,5,"Consumer brands like The League are increasingly leveraging LinkedIn creators to reach the platform's affluent, intent-driven audience."
2026-04-22,Digiday,Why live streaming is the borderless $4 billion global opportunity publishers can’t ignore,https://digiday.com/sponsored/why-live-streaming-is-a-borderless-4-billion-global-opportunity/?utm_campaign=digidaydis&utm_medium=rss&utm_source=general-rss,"Ad Formats, FAANG, Industry/Business","live streaming, live sports streaming, publisher monetization, global streaming opportunity",Google,,,"CTV/OTT, Video",,6,Google's Shane Peros argues that the migration of live events from cable to streaming represents a $4 billion borderless global opportunity for publishers.
2026-04-27,AdExchanger,Brands Can Now Deploy Their Own Agents Inside Publisher Chatbots,https://www.adexchanger.com/publishers/brands-can-now-deploy-their-own-agents-inside-publisher-chatbots/,"Technology, Retail Media, FAANG, Industry/Business","AI shopping agents, brand agents, publisher chatbots, AI monetization, agentic commerce",Amazon,"Walmart Connect, Amazon Ads",,,,7,"Dappier is enabling brands to deploy their own AI shopping agents inside publisher chatbots, expanding the agentic commerce trend beyond retailer platforms like Walmart's Sparky and Amazon's Rufus."
2026-04-27,AdExchanger,Gotta CTV It To Believe It; TBPN’s Ad Tech Emmy Campaign,https://www.adexchanger.com/daily-news-roundup/monday-27042026/,"Ad Formats, Privacy/Regulation, Industry/Business","political advertising on CTV, podcast advertising, data privacy legislation, SECURE Data Act",,,,"CTV/OTT, Audio",,6,"A daily news roundup covering political ads on CTV, OpenAI's new podcast, and the implications of the SECURE Data Act."
2026-04-24,AdExchanger,Does The New Federal Data Privacy Bill Have A Snowball’s Chance Of Passing?,https://www.adexchanger.com/data-privacy/does-the-new-federal-data-privacy-bill-have-a-snowballs-chance-of-passing/,"Privacy/Regulation, Industry/Business","federal privacy legislation, state privacy laws, preemption",,,,,,7,"House Republicans have introduced a new federal data privacy bill that would preempt state privacy laws, though preemption has historically blocked such legislation from passing."
2026-04-24,AdExchanger,An Audience So Nice You Bought It Twice (And That’s Not A Good Thing),https://www.adexchanger.com/content-studio/an-audience-so-nice-you-bought-it-twice-and-thats-not-a-good-thing/,"Programmatic, Ad Formats, Industry/Business","audience overlap, cross-screen measurement, upfront vs programmatic, media planning silos, frequency management",Google,,,"CTV/OTT, Video",,6,"The article argues that siloed upfront and programmatic media plans cause brands to redundantly buy the same audiences across linear TV, CTV, YouTube and the open web."
2026-04-24,AdExchanger,"Streaming Platforms Are Embracing Vertical Video. But At This Point, Is It Worth It?",https://www.adexchanger.com/ctv-roundup/streaming-platforms-are-embracing-vertical-video-but-at-this-point-is-it-worth-it/,"Ad Formats, Industry/Business","vertical video, streaming platforms, CTV advertising, ad monetization",,,,"CTV/OTT, Video",,6,"Streaming services are increasingly adopting vertical video formats, but the lack of ad monetization raises questions about its current value to the industry."
2026-04-24,AdExchanger,Programmatic Peacekeeping,https://www.adexchanger.com/the-big-story/programmatic-peacekeeping/,"Programmatic, Industry/Business","transaction IDs, supply path optimization, programmatic transparency, industry standards",,,,,,7,"OMD's Ben Hovaness discusses leading a new industry group aimed at reducing programmatic infighting, sparked by recent LinkedIn debates over transaction IDs."
2026-04-24,AdExchanger,Why Not Just Read AdExchanger?; Tubi Or Not Tubi,https://www.adexchanger.com/daily-news-roundup/friday-24042026/,"Industry/Business, Ad Formats, Technology","ad tech vendor marketing, AI-based ad platforms, AI model costs, Fox/Tubi advertising",,,,CTV/OTT,,6,"A daily news roundup covering ad tech vendor differentiation marketing, Fox's new AI-based ad platform for Tubi, and the rising costs of maintaining AI models."
2026-04-23,AdExchanger,"Cannes, Captured: AdExchanger and Equativ Partner to Scale the Industry’s Biggest Moments",https://www.adexchanger.com/press-release/cannes-captured-adexchanger-and-equativ-partner-to-scale-the-industrys-biggest-moments/,Industry/Business,"industry events, Cannes Lions, media partnership",,,,,,3,AdExchanger announces a partnership with Equativ to produce and distribute live content and executive conversations from Cannes Lions 2026.
2026-04-23,AdExchanger,NBCU’s Peacock Is Officially On Its Way To Profitability,https://www.adexchanger.com/marketers/nbcus-peacock-is-officially-on-its-way-to-profitability/,"Industry/Business, Ad Formats","Peacock streaming, ad-supported streaming, NBCUniversal, streaming profitability",,,,CTV/OTT,,6,NBCUniversal's Peacock streaming service is on a path to profitability following a strong February performance.
2026-04-23,AdExchanger,ChatGPT Ads Have Begun Showing Up For Logged-Out Users,https://www.adexchanger.com/ai/chatgpt-ads-have-begun-showing-up-for-logged-out-users/,"Technology, Industry/Business, Ad Formats","ChatGPT advertising, AI chatbot ads, generative AI monetization, minimum spend budgets",,,,Native,,8,"ChatGPT has begun showing ads to logged-out users, expanding inventory for advertisers who previously struggled to meet minimum spend thresholds on the platform."
2026-04-30,Digiday,X upgrades its ad platform in long overdue overhaul,https://digiday.com/marketing/x-upgrades-its-ad-platform-in-long-overdue-overhaul/?utm_campaign=digidaydis&utm_medium=rss&utm_source=general-rss,"Major Ad Tech Companies, Industry/Business","X ad platform overhaul, ad platform performance, social advertising",,,,Social,,7,"X (formerly Twitter) has rolled out the largest update to its advertising platform in its history, addressing long-standing criticism about lagging performance compared to competitors."
2026-04-30,Digiday,The Rundown: Google expands AI Max as automation shifts upstream,https://digiday.com/media-buying/the-rundown-google-expands-ai-max-as-automation-shifts-upstream/?utm_campaign=digidaydis&utm_medium=rss&utm_source=general-rss,"Major Ad Tech Companies, Industry/Business, Technology","AI-powered ad automation, Google AI Max, Alphabet Q1 earnings, campaign automation",Google,,,Search,,8,"Google expands its AI Max automation tools for advertisers as parent Alphabet reports $110 billion in Q1 revenue, signaling a continued shift toward AI-driven campaign management."
2026-04-30,Digiday,How former college athlete and Airbnb host turned Love Island fame into widespread success,https://digiday.com/media/how-former-college-athlete-and-airbnb-host-turned-love-island-fame-into-widespread-success/?utm_campaign=digidaydis&utm_medium=rss&utm_source=general-rss,Industry/Business,"creator economy, influencer marketing",,,,,,2,A profile of Love Island star TJ Palma leveraging his reality TV fame and creator content to grow his existing businesses.
2026-04-30,Digiday,Uncertainty is the real cost of the Middle East war for advertisers,https://digiday.com/media-buying/uncertainty-is-the-real-cost-of-the-middle-east-war-for-advertisers/?utm_campaign=digidaydis&utm_medium=rss&utm_source=general-rss,Industry/Business,"geopolitical risk, advertiser uncertainty, ad spend impact",,,,,,4,An analysis of how geopolitical uncertainty from the Middle East war is creating unpredictable conditions for advertisers and their media planning.
2026-04-30,Digiday,Media Briefing: Publishers rewire sales teams for the outcomes era,https://digiday.com/media/media-briefing-publishers-rewire-sales-teams-for-the-outcomes-era/?utm_campaign=digidaydis&utm_medium=rss&utm_source=general-rss,"Industry/Business, Attribution/Measurement","publisher ad sales, outcome-based advertising, performance advertising, sales team restructuring",,,,,,6,Publishers are restructuring their ad sales teams to focus on performance outcomes and client success rather than traditional impression-based selling.
2026-05-04,Adweek,"Could a Unified, Independent Measurement System for CTV Be Close?",https://www.adweek.com/convergent-tv/could-a-unified-independent-measurement-system-for-ctv-be-close/,"Ad Formats, Attribution/Measurement, Technology, Industry/Business","CTV advertising, unified measurement, independent measurement, CTV ecosystem maturity, programmatic CTV, cross-platform measurement",,,"MMM, Incrementality, Cookieless",CTV/OTT,,7,"A Viant-sponsored article exploring the progress and potential of a unified, independent measurement system for CTV advertising as the ecosystem matures and faces new challenges."
2026-05-04,Adweek,How Marketers Can Get Clean Incrementality Measurements in a Messy World,https://www.adweek.com/performance-marketing/how-marketers-can-get-clean-incrementality-measurements-in-a-messy-world/,Attribution/Measurement,"incrementality testing, campaign measurement, behavioral lift, marketing effectiveness",,,Incrementality,,,7,A sponsored post by Fetch outlines how marketers can achieve clean incrementality measurements to accurately determine whether campaigns are driving real behavioral change.
2026-05-04,Adweek,Turning Complex Data Into Genuine Audience Connections,https://www.adweek.com/brand-marketing/turning-complex-data-into-genuine-audience-connections/,"Retail Media, Attribution/Measurement, Industry/Business","purchase intent targeting, audience data, retail media data, first-party data, consumer insights",,Other,,,,4,A sponsored post from Inmar Media discussing how marketing teams can leverage data to better understand and connect with target audiences based on purchase intent signals.
2026-05-04,Adweek,Here Are the Cable News Ratings for April 2026,https://www.adweek.com/tvnewser/here-are-the-cable-news-ratings-for-april-2026/,Industry/Business,"cable news ratings, TV viewership",,,,,,2,Fox News maintained its lead in total viewers and the key demo during April 2026 despite experiencing viewership declines compared to prior periods.
2026-05-04,Adweek,Fox Sports Looks for a ‘Miracle’ With Its World Cup Promo Campaign,https://www.adweek.com/convergent-tv/fox-sports-looks-for-a-miracle-with-its-world-cup-promo-campaign/,"Industry/Business, Ad Formats","sports advertising, brand campaigns, video advertising, World Cup marketing",,,,Video,,2,Fox Sports launches a celebrity-driven promotional ad campaign for its upcoming World Cup broadcast coverage.
2026-05-01,Adweek,Ticker: Testy Exchange Takes Place Between Scott Jennings and Adam Mockler on CNN NewsNight,https://www.adweek.com/tvnewser/ticker-testy-exchange-takes-place-between-scott-jennings-and-adam-mockler-on-cnn-newsnight/,Industry/Business,"media news, cable news, podcast launch",,,,,,1,"A brief ticker item covering a contentious CNN NewsNight exchange between Scott Jennings and Adam Mockler, along with Newsmax announcing a new podcast with Greta Van Susteren."
2026-05-01,Adweek,The Marketing CEO: Why Leadership Now Starts With Knowing Your Brand Identity,https://www.adweek.com/brand-marketing/the-marketing-ceo-why-leadership-now-starts-with-knowing-your-brand-identity/,Industry/Business,"brand identity, marketing leadership, CEO strategy",,,,,,2,This article argues that modern CEOs must prioritize marketing and brand identity as a core leadership competency.
2026-05-01,Adweek,AI Is Bringing Retail Media Closer to the Sale,https://www.adweek.com/commerce/ai-is-bringing-retail-media-closer-to-the-sale/,"Retail Media, Technology, Industry/Business","retail media networks, AI in advertising, retail media measurement, brand growth strategy",,Other,,Retail Media Ads,,6,A sponsored post in partnership with CVS Media Exchange examines how AI is helping brands navigate the growing complexity of retail media and drive closer connections to purchase.
2026-05-01,Adweek,What It Takes to Grow a CPG Challenger Brand,https://www.adweek.com/brand-marketing/what-it-takes-to-grow-a-cpg-challenger-brand/,"Retail Media, Industry/Business","CPG advertising, challenger brand marketing, retail media, Ibotta",,Other,,,,4,A sponsored post in partnership with Ibotta explores the challenges and strategies for CPG challenger brands trying to grow and compete in a crowded retail marketplace.
2026-05-01,Adweek,"For Creator-Led Campaigns, Authenticity Starts Before the Shoot",https://www.adweek.com/creativity/for-creator-led-campaigns-authenticity-starts-before-the-shoot/,Industry/Business,"creator-led campaigns, influencer marketing, small business marketing, branded content",,,,Social,,2,A sponsored post in partnership with Collectively discusses how small business owners can leverage creator-led campaigns with authenticity as a foundation for their marketing efforts.
2026-05-04,Digiday,"From ad tech tax to AI data brokers: the new middlemen keep 100%, publishers say",https://digiday.com/media/from-ad-tech-tax-to-ai-data-brokers-the-new-middlemen-keep-100-publishers-say/?utm_campaign=digidaydis&utm_medium=rss&utm_source=general-rss,"Industry/Business, Privacy/Regulation, Technology, Major Ad Tech Companies","AI content scraping, publisher monetization, ad tech tax, AI data brokers, content licensing, publisher revenue, AI training data","OpenAI/ChatGPT, Google",,,,,6,"Publishers argue that AI companies scraping their content without compensation represents a more existential threat than the ad tech tax, as it removes their content entirely from the monetization equation rather than simply taking a cut of it."
2026-05-04,Digiday,Media Buying Briefing: Rival trade bodies emerge to contend programmatic’s future,https://digiday.com/media-buying/media-buying-briefing-rival-trade-bodies-emerge-to-contend-programmatics-future/?utm_campaign=digidaydis&utm_medium=rss&utm_source=general-rss,"Programmatic, Industry/Business, Technology","agentic media buying, agentic media planning, programmatic advertising, trade body politics, industry standards, AI in media buying",,,,,,8,Competing trade organizations are forming rival camps around the future of programmatic advertising as agentic AI-driven media planning and buying threatens to disrupt established industry norms and power structures.
2026-05-04,Digiday,TikTok recreates its ads for billboards through Vistar partnership,https://digiday.com/marketing/tiktok-recreates-its-ads-for-billboards-through-vistar-partnership/?utm_campaign=digidaydis&utm_medium=rss&utm_source=general-rss,"Major Ad Tech Companies, Ad Formats, Industry/Business","DOOH advertising, OOH creative strategy, TikTok ads, brand partnerships, ad creative adaptation, programmatic DOOH",TikTok,,,"DOOH, Social",,6,"TikTok has partnered with Vistar Media to rebuild its social ad creative specifically for out-of-home billboards, prioritizing bespoke execution over simple repurposing of existing assets."
2026-05-04,Digiday,The state of generative AI in the creator economy,https://digiday.com/media/the-state-of-generative-ai-in-the-creator-economy/?utm_campaign=digidaydis&utm_medium=rss&utm_source=general-rss,"Industry/Business, Technology","generative AI, creator economy, influencer marketing, AI workflow tools, brand partnerships",,,,,,2,This article examines how creators are leveraging generative AI tools to streamline workflows and identify brand partnership opportunities through channels like DMs.
2026-05-01,Digiday,OpenAI starts laying foundations for ChatGPT ads in EU,https://digiday.com/marketing/openai-starts-laying-foundations-for-chatgpt-ads-in-eu/?utm_campaign=digidaydis&utm_medium=rss&utm_source=general-rss,"Major Ad Tech Companies, Privacy/Regulation, Attribution/Measurement, Industry/Business","ChatGPT ads, conversational advertising, consent management, EU privacy compliance, conversion pixel, GDPR, ad infrastructure",OpenAI/ChatGPT,,Cookieless,,,7,"OpenAI is building consent-first ad infrastructure for ChatGPT in the EU, with updates to its conversion pixel signaling a privacy-compliant approach shaped by stricter European regulations."
2026-05-01,Digiday,Baller League’s creator strategy: reach is not the same as fandom,https://digiday.com/marketing/baller-leagues-creator-strategy-reach-is-not-the-same-as-fandom/?utm_campaign=digidaydis&utm_medium=rss&utm_source=general-rss,Industry/Business,"creator marketing, sports media, fandom building, franchise development, influencer strategy",,,,Social,,2,Baller League is prioritizing deep fan engagement over broad reach as the foundation of its growth and franchise sales strategy.
2026-05-01,Digiday,Marketers question expensive AI visibility tools as inconsistent results fuel skepticism,https://digiday.com/marketing/marketers-question-expensive-ai-visibility-tools-as-inconsistent-results-fuel-skepticism/?utm_campaign=digidaydis&utm_medium=rss&utm_source=general-rss,"Major Ad Tech Companies, Technology, Industry/Business","AI visibility tools, zero-click search, AI search advertising, brand visibility measurement, AI-generated answers, search disruption","Google, OpenAI/ChatGPT",,,Search,,6,"Marketers are increasingly investing in AI visibility tools to track brand presence in AI-generated search answers, but inconsistent results and the absence of industry benchmarks are creating skepticism about their value."
2026-05-01,Digiday,"Future of Marketing Briefing: YouTube’s creator data play is an on-ramp, not a destination",https://digiday.com/media-buying/future-of-marketing-briefing-youtubes-creator-data-play-is-an-on-ramp-not-a-destination/?utm_campaign=digidaydis&utm_medium=rss&utm_source=general-rss,"Major Ad Tech Companies, Attribution/Measurement, Industry/Business","creator data, audience targeting, YouTube advertising, first-party data, influencer marketing, brand safety, creator monetization",Google,,,"Video, Social",,6,"YouTube is offering brands new access to creator data for targeting and measurement, but advertisers are already anticipating deeper capabilities the platform has yet to deliver."
2026-05-01,Digiday,Taboola’s next act: an AI answer engine for publishers,https://digiday.com/media/taboolas-next-act-an-ai-answer-engine-for-publishers/?utm_campaign=digidaydis&utm_medium=rss&utm_source=general-rss,"Major Ad Tech Companies, Technology, Industry/Business, Ad Formats","AI answer engine, publisher monetization, native advertising, content recommendation, AI-powered engagement, publisher tools",OpenAI/ChatGPT,,,Native,,5,"Taboola is launching an AI-powered answer engine being adopted by publishers including HuffPost UK, Reach, and USA Today Co. to increase user engagement on their platforms."
2026-05-01,Digiday,"USA Today Co.’s AI licensing deals drive ‘notable’ revenue in Q1, despite pressure on traffic and programmatic",https://digiday.com/media/usa-today-co-s-ai-licensing-deals-drive-notable-revenue-in-q1-despite-pressure-on-traffic-and-programmatic/?utm_campaign=digidaydis&utm_medium=rss&utm_source=general-rss,"Programmatic, Industry/Business, Technology","AI licensing, programmatic advertising, publisher revenue, traffic trends, programmatic pressure",,,,,,5,"USA Today Co. reported notable year-over-year revenue growth in Q1 driven by AI content licensing deals, even as the publisher faced headwinds from declining traffic and softening programmatic advertising revenue."
2026-05-04,AdExchanger,"Losing Traffic To AI Search? Do More Video, Says Major League Fishing’s Jared Collett",https://www.adexchanger.com/publishers/losing-traffic-to-ai-search-do-more-video-says-major-league-fishings-jared-collett/,"Ad Formats, Industry/Business, Major Ad Tech Companies","AI search impact on publisher traffic, video advertising strategy, publisher ad operations, sports media publishing",OpenAI/ChatGPT,,,Video,,5,Major League Fishing's ad ops lead discusses how publishers can offset traffic losses from AI search by investing more heavily in video content and advertising.
2026-05-04,AdExchanger,Upfronts Advertisers Say They Want Outcomes – And Amazon Licks Its Chops,https://www.adexchanger.com/marketers/upfronts-advertisers-say-they-want-outcomes-and-amazon-licks-its-chops/,"Retail Media, Major Ad Tech Companies, Attribution/Measurement, Ad Formats, Industry/Business","upfronts, outcomes-based advertising, TV advertising, cross-channel measurement, brand measurement, CTV advertising, retail media measurement",Amazon,Amazon Ads,"Incrementality, MMM","CTV/OTT, Video",,7,"As TV advertisers enter the 2026 upfronts season demanding outcomes-based buying, Amazon Ads is positioning its retail data and cross-channel measurement capabilities as a key differentiator to capture shifting TV ad budgets."
2026-05-04,AdExchanger,Who Actually Owns AI Governance?,https://www.adexchanger.com/data-privacy-roundup/who-actually-owns-ai-governance/,"Privacy/Regulation, Technology, Industry/Business","AI governance, data privacy, data minimization, consent management, dark patterns, kids privacy, AI regulation, data governance",,,,,,5,"The article examines the emerging and unresolved question of who within organizations bears responsibility for AI governance, as it adds complexity on top of existing privacy, security, and data governance obligations that advertisers already manage."
